{
    "artifact": "08_code_overview",
    "schema_version": "0.1.0",
    "project": "AVA Fabric - Legacy Delphi Migration",
    "description": "Levantamento geral (LOC, módulos, forms, telas, métricas)",
    "payload": {
        "totals": {
            "units_parsed_ast": 30,
            "loc_total": 4630,
            "classes": 30,
            "procedures": 253,
            "functions": 88,
            "forms_screens": 22,
            "input_fields": 92,
            "avg_cyclomatic": 3.1,
            "units_total": 30,
            "business_rules": 6,
            "integrations": 2,
            "apis": 0,
            "db_tables": 11,
            "mode": "ast+regex-fallback"
        },
        "classes": "[30]{attributes:json,file:string,line:int,name:string,parent:string?}\n\"[]\",uClassBancos.pas,5,ClassBancos,\n\"[]\",uClassClienteFornecedor.pas,5,ClassClienteFornecedor,\n\"[]\",uClassContasCorrente.pas,5,ClassContasCorrente,\n\"[]\",uClassContasPagar.pas,5,ClassContasPagar,\n\"[]\",uClassContasReceber.pas,5,ClassContasReceber,\n\"[]\",uClassGrupoCF.pas,6,ClassGrupoCF,\n\"[]\",uClassLancamentosCP.pas,5,ClassLancamentosCP,\n\"[]\",uClassLancamentosCR.pas,5,ClassLancamentosCR,\n\"[]\",uClientesFornecedores.pas,11,TfrmClientesFornecedores,TForm\n\"[]\",uClientesFornecedoresCadastrados.pas,11,TfrmClieFornCadastrados,TForm\n\"[]\",uGruposCF.pas,11,TfrmGruposCF,TForm\n\"[]\",uGruposCFCadastrados.pas,11,TfrmGruposCFCadastrados,TForm\n\"[]\",udmImprimir.pas,10,TdmImprimir,TDataModule\n\"[]\",uBaixarTituloLancamentosCP.pas,12,TfrmBaixarTituloLancamentosCP,TForm\n\"[]\",uBaixarTituloLancamentosCR.pas,12,TfrmBaixarTituloLancamentosCR,TForm\n\"[]\",uBancos.pas,11,TfrmBancos,TForm\n\"[]\",uBancosCadastrados.pas,11,TfrmBancosCadastrados,TForm\n\"[]\",uContasCorrente.pas,11,TfrmContasCorrente,TForm\n\"[]\",uContasCorrenteCadastradas.pas,11,TfrmContasCorrenteCadastradas,TForm\n\"[]\",uContasPagar.pas,12,TfrmContasPagar,TForm\n\"[]\",uContasPagarCadastradas.pas,11,TfrmContasPagarCadastradas,TForm\n\"[]\",uContasReceber.pas,12,TfrmContasReceber,TForm\n\"[]\",uContasReceberCadastradas.pas,12,TfrmContasReceberCadastradas,TForm\n\"[]\",uPlanoContas.pas,10,TfrmPlanoContas,TForm\n\"[]\",uPlanoContasCadastradas.pas,11,TfrmPlanoContasCadastradas,TForm\n\"[]\",uTiposCobranca.pas,10,TfrmTiposCobranca,TForm\n\"[]\",uTiposCobrancaCadastrados.pas,11,TfrmTiposCobrancaCadastrados,TForm\n\"[]\",uTiposPagamento.pas,10,TfrmTiposPagamento,TForm\n\"[]\",uTiposPagamentoCadastrados.pas,11,TfrmTiposPagamentoCadastrados,TForm\n\"[]\",uPrincipal.pas,14,TfrmPrincipal,TForm\n",
        "complexity_by_unit": [
            {
                "unit": "uContasReceber",
                "cyclomatic": 9,
                "methods": 15
            },
            {
                "unit": "uClientesFornecedores",
                "cyclomatic": 8,
                "methods": 13
            },
            {
                "unit": "uBaixarTituloLancamentosCP",
                "cyclomatic": 6,
                "methods": 18
            },
            {
                "unit": "uBaixarTituloLancamentosCR",
                "cyclomatic": 6,
                "methods": 17
            },
            {
                "unit": "uContasCorrente",
                "cyclomatic": 6,
                "methods": 9
            },
            {
                "unit": "uContasPagar",
                "cyclomatic": 5,
                "methods": 13
            },
            {
                "unit": "uContasPagarCadastradas",
                "cyclomatic": 5,
                "methods": 8
            },
            {
                "unit": "uPlanoContasCadastradas",
                "cyclomatic": 4,
                "methods": 6
            },
            {
                "unit": "uTiposCobrancaCadastrados",
                "cyclomatic": 4,
                "methods": 6
            },
            {
                "unit": "uTiposPagamentoCadastrados",
                "cyclomatic": 4,
                "methods": 7
            },
            {
                "unit": "uClientesFornecedoresCadastrados",
                "cyclomatic": 3,
                "methods": 6
            },
            {
                "unit": "uGruposCF",
                "cyclomatic": 3,
                "methods": 5
            },
            {
                "unit": "uGruposCFCadastrados",
                "cyclomatic": 3,
                "methods": 6
            },
            {
                "unit": "uContasReceberCadastradas",
                "cyclomatic": 3,
                "methods": 4
            },
            {
                "unit": "uPlanoContas",
                "cyclomatic": 3,
                "methods": 3
            }
        ]
    },
    "_volatile": {
        "generated_at": "2026-07-07T16:35:57.509305+00:00",
        "run_id": "211b1ad3915d",
        "analyzer": "delphi_ast_analyzer/0.1.0",
        "source_root": "./examples/Meu-ERP"
    }
}