{
  "artifact": "01_business_rules",
  "schema_version": "0.1.0",
  "project": "AVA Fabric - Legacy Delphi Migration",
  "description": "Regras de negócio (validações, cálculos, workflow no código)",
  "payload": {
    "counts": {
      "total": 0,
      "by_type": {},
      "mode": "regex-only"
    },
    "rules": []
  },
  "_volatile": {
    "generated_at": "2026-07-07T10:58:13.471421+00:00",
    "run_id": "0c2410168872",
    "analyzer": "delphi_ast_analyzer/0.1.0",
    "source_root": "./examples/Meu-ERP"
  }
}