{"artifact": "01_business_rules", "schema_version": "0.1.0", "project": "AVA Fabric - Legacy Delphi Migration", "description": "Regras de negócio (validações, cálculos, workflow no código)", "payload": {"counts": {"total": 6, "by_type": {"calculation": 6}, "mode": "ast+regex-fallback"}, "rules": [{"type": "calculation", "unit": "uBaixarTituloLancamentosCP", "method": "TfrmBaixarTituloLancamentosCP.AtualizarSaldoDevedor", "target": "self.edtSaldoDevedor.Text", "expression": "FloatTOStr(StrToFloat(self.edtSaldoDevedor.Text) - StrToFloat(self.edtValorPago.Text))", "source_ref": {"file": "uBaixarTituloLancamentosCP.pas", "line": 181}, "id": "BR-0001"}, {"type": "calculation", "unit": "uBaixarTituloLancamentosCP", "method": "TfrmBaixarTituloLancamentosCP.AtualizarContaCorrente", "target": "saldo", "expression": "saldo - self.lancamentoCP.getValorPago", "source_ref": {"file": "uBaixarTituloLancamentosCP.pas", "line": 193}, "id": "BR-0002"}, {"type": "calculation", "unit": "uBaixarTituloLancamentosCR", "method": "TfrmBaixarTituloLancamentosCR.AtualizarSaldoCredor", "target": "self.edtSaldoCredor.Text", "expression": "FloatTOStr(StrToFloat(self.edtSaldoCredor.Text) - StrToFloat(self.edtValorRecebido.Text))", "source_ref": {"file": "uBaixarTituloLancamentosCR.pas", "line": 213}, "id": "BR-0003"}, {"type": "calculation", "unit": "uBaixarTituloLancamentosCR", "method": "TfrmBaixarTituloLancamentosCR.AtualizarContaCorrente", "target": "saldo", "expression": "saldo + self.lancamentoCR.getValorRecebido", "source_ref": {"file": "uBaixarTituloLancamentosCR.pas", "line": 225}, "id": "BR-0004"}, {"type": "calculation", "unit": "uContasPagar", "method": "TfrmContasPagar.PegarUltimaConta", "target": "num_conta", "expression": "IntToStr(StrToInt(num_conta) + 1)", "source_ref": {"file": "uContasPagar.pas", "line": 188}, "id": "BR-0005"}, {"type": "calculation", "unit": "uContasReceber", "method": "TfrmContasReceber.PegarUltimaConta", "target": "num_conta", "expression": "IntToStr(StrToInt(num_conta) + 1)", "source_ref": {"file": "uContasReceber.pas", "line": 233}, "id": "BR-0006"}]}, "_volatile": {"generated_at": "2026-07-07T14:29:34.067360+00:00", "run_id": "8b37039f6672", "analyzer": "delphi_ast_analyzer/0.1.0", "source_root": "C:\\Desenv\\Meu-ERP"}}