{"artifact": "03_database_rules", "schema_version": "0.1.0", "project": "AVA Fabric - Legacy Delphi Migration", "description": "Regras de banco (constraints, transações, integridade)", "payload": {"counts": {"total": 27, "mode": "ast+regex-fallback"}, "rules": "[27]{id:string,operation:string,source_ref.file:string,source_ref.line:int,tables:json,type:string}\nDBR-0001,insert,uClientesFornecedores.pas,124,\"[\"\"cliente_fornecedor\"\"]\",write_operation\nDBR-0002,delete,uClientesFornecedoresCadastrados.pas,59,\"[\"\"cliente_fornecedor\"\"]\",write_operation\nDBR-0003,insert,uGruposCF.pas,52,\"[\"\"grupo_cliente_fornecedor\"\"]\",write_operation\nDBR-0004,insert,uGruposCF.pas,55,\"[\"\"grupo_cliente_fornecedor\"\"]\",write_operation\nDBR-0005,delete,uGruposCFCadastrados.pas,53,\"[\"\"grupo_cliente_fornecedor\"\"]\",write_operation\nDBR-0006,insert,uBaixarTituloLancamentosCP.pas,128,\"[\"\"lancamento\"\"]\",write_operation\nDBR-0007,update,uBaixarTituloLancamentosCP.pas,154,\"[\"\"contas_pagar\"\"]\",write_operation\nDBR-0008,update,uBaixarTituloLancamentosCP.pas,167,\"[\"\"contas_pagar\"\"]\",write_operation\nDBR-0009,update,uBaixarTituloLancamentosCP.pas,196,\"[\"\"conta_corrente\"\"]\",write_operation\nDBR-0010,insert,uBaixarTituloLancamentosCR.pas,177,\"[\"\"lancamento_contas_receber\"\"]\",write_operation\nDBR-0011,update,uBaixarTituloLancamentosCR.pas,203,\"[\"\"contas_receber\"\"]\",write_operation\nDBR-0012,update,uBaixarTituloLancamentosCR.pas,228,\"[\"\"conta_corrente\"\"]\",write_operation\nDBR-0013,update,uBaixarTituloLancamentosCR.pas,273,\"[\"\"contas_receber\"\"]\",write_operation\nDBR-0014,insert,uBancos.pas,51,\"[\"\"banco\"\"]\",write_operation\nDBR-0015,insert,uContasCorrente.pas,86,\"[\"\"conta_corrente\"\"]\",write_operation\nDBR-0016,insert,uContasPagar.pas,154,\"[\"\"contas_pagar\"\"]\",write_operation\nDBR-0017,delete,uContasPagarCadastradas.pas,92,\"[\"\"contas_pagar\"\"]\",write_operation\nDBR-0018,insert,uContasReceber.pas,199,\"[\"\"contas_receber\"\"]\",write_operation\nDBR-0019,insert,uPlanoContas.pas,63,\"[\"\"plano_contas\"\"]\",write_operation\nDBR-0020,insert,uPlanoContas.pas,66,\"[\"\"plano_contas\"\"]\",write_operation\nDBR-0021,delete,uPlanoContasCadastradas.pas,50,\"[\"\"plano_contas\"\"]\",write_operation\nDBR-0022,insert,uTiposCobranca.pas,63,\"[\"\"tipo_cobranca\"\"]\",write_operation\nDBR-0023,insert,uTiposCobranca.pas,66,\"[\"\"tipo_cobranca\"\"]\",write_operation\nDBR-0024,delete,uTiposCobrancaCadastrados.pas,49,\"[\"\"tipo_cobranca\"\"]\",write_operation\nDBR-0025,insert,uTiposPagamento.pas,63,\"[\"\"tipo_pagamento\"\"]\",write_operation\nDBR-0026,insert,uTiposPagamento.pas,66,\"[\"\"tipo_pagamento\"\"]\",write_operation\nDBR-0027,delete,uTiposPagamentoCadastrados.pas,50,\"[\"\"tipo_pagamento\"\"]\",write_operation\n"}, "_volatile": {"generated_at": "2026-07-07T14:29:34.076763+00:00", "run_id": "8b37039f6672", "analyzer": "delphi_ast_analyzer/0.1.0", "source_root": "C:\\Desenv\\Meu-ERP"}}